{
  "schemaVersion": 1,
  "toolId": "tool.fs.read",
  "name": "filesystem-read",
  "version": "1.0.0",
  "source": { "origin": "mcp-server", "url": "mcp://local/fs" },
  "integrity": { "algorithm": "sha256", "digest": "e3b0c44298fc1c149afbf4c8996fb92427ae41e4649b934ca495991b7852b855" },
  "transport": "mcp",
  "inputSchemaRef": "urn:koquetel:schema:tool-input:fs-read:1",
  "outputSchemaRef": "urn:koquetel:schema:tool-output:fs-read:1",
  "requestedCapabilities": ["workspace-read"],
  "manifestDigest": "9f86d081884c7d659a2feaa0c55ad015a3bf4f1b2b0b822cd15d6c15b0f00a08",
  "healthState": "healthy",
  "admissionState": "admitted"
}
